{
  "attempt_id": "semantic_attempt_sha256_3d6dc1c63badedcc600e43c565e39e1a9af77711a37e74c5beb0ddbbe51b70ba",
  "contract_version": "tbm.semantic-gate-attempt.v3",
  "decision_id": "decision_001",
  "endpoint_id": "deployment_001",
  "error_code": null,
  "final_allowed_revision_ids": [
    "memory_revision_sha256_aaaaaaaaaaaaaaaaaaaaaaaaaaaaaaaaaaaaaaaaaaaaaaaaaaaaaaaaaaaaaaaa"
  ],
  "final_blocked_revision_ids": [],
  "finished_at": "2026-07-27T08:02:01Z",
  "generation_config_sha256": "sha256:7777777777777777777777777777777777777777777777777777777777777777",
  "input_tokens": 100,
  "latency_ms": 500,
  "model_id": "gate_model",
  "model_version": "2026-07-01",
  "output_tokens": 25,
  "previous_attempt_id": null,
  "prompt_artifact_sha256": "sha256:5555555555555555555555555555555555555555555555555555555555555555",
  "prompt_template_id": "semantic_gate_prompt",
  "prompt_template_version": "3.0",
  "provider_id": "provider_001",
  "provider_request_id": "provider_request_001",
  "reason": "Applicable to this run.",
  "recommended_injection": "summary",
  "response_artifact_sha256": "sha256:6666666666666666666666666666666666666666666666666666666666666666",
  "retrieval_snapshot_id": "retrieval_snapshot_sha256_02558908c6d8f0b062688ad385d757c24d7b61936249af4d25cbc26745626bca",
  "risk": "low",
  "sequence": 1,
  "session_id": "session_001",
  "started_at": "2026-07-27T08:02:00Z",
  "status": "succeeded",
  "system_gate_evaluation_id": "system_gate_sha256_c67ff5d46b0981507946a83ec12d869e893cfae6712b07e27b2d87d2f8aad49d"
}
